"","text","favorited","favoriteCount","replyToSN","created","truncated","replyToSID","id","replyToUID","statusSource","screenName","retweetCount","isRetweet","retweeted","longitude","latitude"
"1","I'm still asking you to believe - not in my ability to bring about change, but in yours. I believe in change because I believe in you.",FALSE,768064,"POTUS44",2017-01-20 14:13:35,FALSE,"822446334787600385","822446982648201216","1536791610","<a href=""http://twitter.com"" rel=""nofollow"">Twitter Web Client</a>","POTUS44",306053,FALSE,FALSE,NA,NA
"2","As we look forward, I want our first steps to reflect what matters most to you. Share your thoughts with me at https://t.co/fGUxlpLVue.",FALSE,198278,"POTUS44",2017-01-20 14:11:01,FALSE,"822446040729157632","822446334787600385","1536791610","<a href=""http://twitter.com"" rel=""nofollow"">Twitter Web Client</a>","POTUS44",51894,FALSE,FALSE,NA,NA
"3","I won't stop; I'll be right there with you as a citizen, inspired by your voices of truth and justice, good humor, and love.",FALSE,561865,"POTUS44",2017-01-20 14:09:51,FALSE,"822445882247413761","822446040729157632","1536791610","<a href=""http://twitter.com"" rel=""nofollow"">Twitter Web Client</a>","POTUS44",190476,FALSE,FALSE,NA,NA
"4","It's been the honor of my life to serve you. You made me a better leader and a better man.",FALSE,1503492,NA,2017-01-20 14:09:13,FALSE,NA,"822445882247413761",NA,"<a href=""http://twitter.com"" rel=""nofollow"">Twitter Web Client</a>","POTUS44",550519,FALSE,FALSE,NA,NA
"5","Proud to make this one of my final actions as President. America is a nation of second chances, and 1,715 people de… https://t.co/vZLJa9SweM",FALSE,213427,NA,2017-01-19 20:39:46,TRUE,NA,"822181779217981441",NA,"<a href=""http://twitter.com/download/iphone"" rel=""nofollow"">Twitter for iPhone</a>","POTUS44",60481,FALSE,FALSE,NA,NA
"6","To the girl from the South Side who took on a role she didn't ask for and made it her own: Happy Birthday, Michelle… https://t.co/cFWec1RQN0",FALSE,1089149,NA,2017-01-17 14:59:24,TRUE,NA,"821371347012087808",NA,"<a href=""http://twitter.com/download/iphone"" rel=""nofollow"">Twitter for iPhone</a>","POTUS44",306785,FALSE,FALSE,NA,NA
"7","From one 44 to another, thanks for finally giving @FLOTUS and generations of hopeful fans a @Cubs championship. https://t.co/RnLyTYF2ub",FALSE,88233,NA,2017-01-17 00:10:24,FALSE,NA,"821147626422800386",NA,"<a href=""http://twitter.com/download/iphone"" rel=""nofollow"">Twitter for iPhone</a>","POTUS44",15398,FALSE,FALSE,NA,NA
"8","In honor of their legacy, @FLOTUS and I are joining Americans across the country in a day of service to our community here in D.C. #MLKDay",FALSE,62855,"POTUS44",2017-01-16 19:50:31,FALSE,"821081947728412672","821082223910780928","1536791610","<a href=""http://twitter.com/download/iphone"" rel=""nofollow"">Twitter for iPhone</a>","POTUS44",10306,FALSE,FALSE,NA,NA
"9","Dr. King and those who marched with him proved that people who love their country can change it. As Americans, we all owe them a great deal.",FALSE,198867,NA,2017-01-16 19:49:25,FALSE,NA,"821081947728412672",NA,"<a href=""http://twitter.com/download/iphone"" rel=""nofollow"">Twitter for iPhone</a>","POTUS44",61711,FALSE,FALSE,NA,NA
"10","That is out of this world. Thanks, @NASA. https://t.co/R8CSjAwt2E",FALSE,164315,NA,2017-01-12 23:57:07,FALSE,NA,"819694728665006080",NA,"<a href=""http://twitter.com/download/iphone"" rel=""nofollow"">Twitter for iPhone</a>","POTUS44",40457,FALSE,FALSE,NA,NA
"11","Thank you for everything. My last ask is the same as my first. I'm asking you to believe—not in my ability to create change, but in yours.",FALSE,1681441,NA,2017-01-11 04:52:08,FALSE,NA,"819044196371800065",NA,"<a href=""http://twitter.com/download/iphone"" rel=""nofollow"">Twitter for iPhone</a>","POTUS44",763220,FALSE,FALSE,NA,NA
"12","It’s been the privilege of my life to serve as your President. I look forward to standing with you as a citizen. Happy New Year everybody.",FALSE,779736,"POTUS44",2017-01-01 17:00:55,FALSE,"815603416089194496","815603723707658241","1536791610","<a href=""http://twitter.com/download/iphone"" rel=""nofollow"">Twitter for iPhone</a>","POTUS44",227932,FALSE,FALSE,NA,NA
"13","From realizing marriage equality to removing barriers to opportunity, we've made history in our work to reaffirm that all are created equal.",FALSE,186927,"POTUS44",2017-01-01 16:59:42,FALSE,"815601969154899969","815603416089194496","1536791610","<a href=""http://twitter.com/download/iphone"" rel=""nofollow"">Twitter for iPhone</a>","POTUS44",46704,FALSE,FALSE,NA,NA
"14","We brought home more of our troops &amp; strengthened U.S. leadership—leading with diplomacy &amp; partnering with nations to meet global problems.",FALSE,71027,"POTUS44",2017-01-01 16:53:57,FALSE,"815601640124387328","815601969154899969","1536791610","<a href=""http://twitter.com/download/iphone"" rel=""nofollow"">Twitter for iPhone</a>","POTUS44",15714,FALSE,FALSE,NA,NA
"15","We traded foreign oil for clean energy, we doubled fuel efficiency standards, &amp; we acted on a global scale to save… https://t.co/U2n4myQUkV",FALSE,61714,"POTUS44",2017-01-01 16:52:38,TRUE,"815601279716225024","815601640124387328","1536791610","<a href=""http://twitter.com/download/iphone"" rel=""nofollow"">Twitter for iPhone</a>","POTUS44",16979,FALSE,FALSE,NA,NA
"16","After decades of rising health care costs, today nearly every American now has access to the financial security of… https://t.co/P9VEPIE3Ab",FALSE,54450,"POTUS44",2017-01-01 16:51:12,TRUE,"815600798558208001","815601279716225024","1536791610","<a href=""http://twitter.com/download/iphone"" rel=""nofollow"">Twitter for iPhone</a>","POTUS44",15393,FALSE,FALSE,NA,NA
"17","Facing the worst financial crisis in 80 years, you delivered the longest streak of job growth in our history. https://t.co/Vk3PfRgZqF",FALSE,73111,"POTUS44",2017-01-01 16:49:18,FALSE,"815600521688055808","815600798558208001","1536791610","<a href=""http://twitter.com/download/iphone"" rel=""nofollow"">Twitter for iPhone</a>","POTUS44",23292,FALSE,FALSE,NA,NA
"18","As we look ahead to the future, I wanted to take a moment to look back on the remarkable progress that you made possible these past 8 years.",FALSE,205866,NA,2017-01-01 16:48:12,FALSE,NA,"815600521688055808",NA,"<a href=""http://twitter.com/download/iphone"" rel=""nofollow"">Twitter for iPhone</a>","POTUS44",44541,FALSE,FALSE,NA,NA
"19","The best part of the holidays is the time we share with those we love. On behalf of Michelle, Malia, and Sasha, Mer… https://t.co/AOai9bJYlg",FALSE,379097,NA,2016-12-25 16:30:27,TRUE,NA,"813059340013895680",NA,"<a href=""http://twitter.com/download/iphone"" rel=""nofollow"">Twitter for iPhone</a>","POTUS44",97648,FALSE,FALSE,NA,NA
"20","A ban on drilling in Arctic waters helps protect the planet we share. Proud to take this step with @JustinTrudeau &amp;… https://t.co/cDbN6inXRy",FALSE,81906,NA,2016-12-20 21:56:09,TRUE,NA,"811329368408621056",NA,"<a href=""http://twitter.com/download/iphone"" rel=""nofollow"">Twitter for iPhone</a>","POTUS44",24525,FALSE,FALSE,NA,NA
"21","The Justice for All bill is a bipartisan step in making our criminal justice system fairer, smarter, and more effective. Proud to sign it.",FALSE,34514,NA,2016-12-16 23:13:35,FALSE,NA,"809899303321866240",NA,"<a href=""http://twitter.com/download/iphone"" rel=""nofollow"">Twitter for iPhone</a>","POTUS44",5927,FALSE,FALSE,NA,NA
"22","The suits said it all – colorful, fun, a little outlandish. That’s what sports should be. Thanks, Craig Sager.  We'll all miss you.",FALSE,47958,NA,2016-12-16 17:00:30,FALSE,NA,"809805411129946115",NA,"<a href=""http://twitter.com/download/iphone"" rel=""nofollow"">Twitter for iPhone</a>","POTUS44",10126,FALSE,FALSE,NA,NA
"23","In signing the Cures Act into law, we're one step closer to breakthroughs on the greatest health challenges of our… https://t.co/LhyahsK0sJ",FALSE,47780,NA,2016-12-13 22:56:10,TRUE,NA,"808807755456937984",NA,"<a href=""http://twitter.com/#!/download/ipad"" rel=""nofollow"">Twitter for iPad</a>","POTUS44",10297,FALSE,FALSE,NA,NA
"24","Great to see so many investors come together to work towards a clean energy future. It's a smart investment and it'… https://t.co/aqGx2t7QAZ",FALSE,45262,NA,2016-12-13 03:15:49,TRUE,NA,"808510710770761728",NA,"<a href=""http://twitter.com"" rel=""nofollow"">Twitter Web Client</a>","POTUS44",11322,FALSE,FALSE,NA,NA
"25","Proud of our Champions of Change - folks who prove that, here in America, there's no more powerful role than that o… https://t.co/wbz1YSlUEx",FALSE,45776,NA,2016-12-05 22:46:10,TRUE,NA,"805906134074847232",NA,"<a href=""http://twitter.com/download/iphone"" rel=""nofollow"">Twitter for iPhone</a>","POTUS44",8936,FALSE,FALSE,NA,NA
"26","Today, we honor those who are leading the fight against HIV/AIDS. Because of them, an AIDS-free generation is now w… https://t.co/yW9uyfbf1x",FALSE,97829,NA,2016-12-01 15:57:15,TRUE,NA,"804353679050543104",NA,"<a href=""http://twitter.com/download/iphone"" rel=""nofollow"">Twitter for iPhone</a>","POTUS44",28945,FALSE,FALSE,NA,NA
"27","This Thanksgiving, we give thanks for our blessings, and work to fulfill the timeless responsibility we have as Americans to serve others.",FALSE,34026,"POTUS44",2016-11-24 18:05:11,FALSE,"801848753468674048","801849159800197121","1536791610","<a href=""http://twitter.com/download/iphone"" rel=""nofollow"">Twitter for iPhone</a>","POTUS44",6887,FALSE,FALSE,NA,NA
"28","The Old Soldiers Home in DC has cared for our nation's veterans for 165 years. I was honored to be a small part of… https://t.co/43ttiaLibI",FALSE,93776,NA,2016-11-24 18:03:35,TRUE,NA,"801848753468674048",NA,"<a href=""http://twitter.com/download/iphone"" rel=""nofollow"">Twitter for iPhone</a>","POTUS44",18509,FALSE,FALSE,NA,NA
"29","Happy birthday, Joe! The best @VP and friend I could have had alongside me these past eight years. https://t.co/kWH3L5uSFC",FALSE,597436,NA,2016-11-20 22:40:00,FALSE,NA,"800468765934690304",NA,"<a href=""http://twitter.com/download/iphone"" rel=""nofollow"">Twitter for iPhone</a>","POTUS44",175671,FALSE,FALSE,NA,NA
"30","One thing I've learned from my time abroad as President: Young people will shape our future long after their leader… https://t.co/bwEltHdPDs",FALSE,83611,NA,2016-11-20 15:17:26,TRUE,NA,"800357392588406785",NA,"<a href=""http://twitter.com/download/iphone"" rel=""nofollow"">Twitter for iPhone</a>","POTUS44",22770,FALSE,FALSE,NA,NA
"31","Today, we honor those who honored our country with its highest form of service. We owe our veterans our thanks, our respect and our freedom.",FALSE,149874,NA,2016-11-11 17:28:48,FALSE,NA,"797128959578271744",NA,"<a href=""http://twitter.com/download/iphone"" rel=""nofollow"">Twitter for iPhone</a>","POTUS44",44439,FALSE,FALSE,NA,NA
"32","Today, progress is on the ballot. Go vote - then make sure your friends, your family, and everyone you know votes too.",FALSE,137422,NA,2016-11-08 15:57:29,FALSE,NA,"796018814072672256",NA,"<a href=""http://twitter.com"" rel=""nofollow"">Twitter Web Client</a>","POTUS44",49656,FALSE,FALSE,NA,NA
"33","It's pretty simple: Find a plan, get covered, earn some peace of mind. Start today: https://t.co/PJ7xIKP3Vo https://t.co/ZBQdNz8s80",FALSE,25458,NA,2016-11-03 23:34:58,FALSE,NA,"794322003754790913",NA,"<a href=""https://studio.twitter.com"" rel=""nofollow"">Twitter Media Studio</a>","POTUS44",6036,FALSE,FALSE,NA,NA
"34","It happened: @Cubs win World Series. That's change even this South Sider can believe in. Want to come to the White House before I leave?",FALSE,252803,NA,2016-11-03 06:03:56,FALSE,NA,"794057504871346176",NA,"<a href=""http://twitter.com/download/iphone"" rel=""nofollow"">Twitter for iPhone</a>","POTUS44",65266,FALSE,FALSE,NA,NA
"35","I'll say it: Holy Cow, @Cubs fans. Even this White Sox fan was happy to see Wrigley rocking last night. #FlyTheW",FALSE,74841,NA,2016-10-23 17:01:02,FALSE,NA,"790236602584948736",NA,"<a href=""http://twitter.com/download/iphone"" rel=""nofollow"">Twitter for iPhone</a>","POTUS44",17946,FALSE,FALSE,NA,NA
"36","Check out my newest science advisors! These kids are fearless in using science to tackle our toughest problems. Tha… https://t.co/pLBZQWDFin",FALSE,60563,NA,2016-10-21 22:44:03,TRUE,NA,"789598150541635588",NA,"<a href=""http://twitter.com/download/iphone"" rel=""nofollow"">Twitter for iPhone</a>","POTUS44",12176,FALSE,FALSE,NA,NA
"37","Outstanding 3 for 3 debate sweep for @HillaryClinton! Nobody has ever been more prepared to be @POTUS.",FALSE,79069,NA,2016-10-20 13:31:12,FALSE,NA,"789096632537055232",NA,"<a href=""http://twitter.com/download/iphone"" rel=""nofollow"">Twitter for iPhone</a>","POTUS44",18589,FALSE,FALSE,NA,NA
"38","For the loved ones we've lost and the ones we can still save, thank you Joe for putting us on the path to ending ca… https://t.co/OPPnQIJDl2",FALSE,22992,NA,2016-10-17 19:26:31,TRUE,NA,"788098889140219904",NA,"<a href=""http://twitter.com/#!/download/ipad"" rel=""nofollow"">Twitter for iPad</a>","POTUS44",5892,FALSE,FALSE,NA,NA
"39","For a century, Planned Parenthood has made it possible for women to determine their own lives. Here's to another #100YearsStrong.",FALSE,96271,NA,2016-10-16 14:30:59,FALSE,NA,"787662124197830656",NA,"<a href=""http://twitter.com/download/iphone"" rel=""nofollow"">Twitter for iPhone</a>","POTUS44",30855,FALSE,FALSE,NA,NA
"40","Clearly, we still have more to do to prevent sexual assault and the thinking that leads to it. That starts with us: https://t.co/9PRZB451fS",FALSE,40631,NA,2016-10-14 21:46:46,FALSE,NA,"787047018606784512",NA,"<a href=""http://twitter.com/download/iphone"" rel=""nofollow"">Twitter for iPhone</a>","POTUS44",14042,FALSE,FALSE,NA,NA
"41","Congratulations to one of my favorite poets, Bob Dylan, on a well-deserved Nobel. https://t.co/c9cnANWPCS",FALSE,30309,NA,2016-10-13 16:05:37,FALSE,NA,"786598777482153988",NA,"<a href=""http://twitter.com/#!/download/ipad"" rel=""nofollow"">Twitter for iPad</a>","POTUS44",10213,FALSE,FALSE,NA,NA
"42","Now this was fun. Artificial intelligence, space travel—hope you enjoy exploring new frontiers as much as I did. https://t.co/WWBUm5eJ08",FALSE,24301,NA,2016-10-12 17:16:09,FALSE,NA,"786254141182074880",NA,"<a href=""http://twitter.com/download/iphone"" rel=""nofollow"">Twitter for iPhone</a>","POTUS44",6869,FALSE,FALSE,NA,NA
"43","On International #DayoftheGirl, we remain committed to providing what we all want for our daughters: a future of limitless possibility.",FALSE,55268,NA,2016-10-11 16:58:15,FALSE,NA,"785887247727857664",NA,"<a href=""http://twitter.com/#!/download/ipad"" rel=""nofollow"">Twitter for iPad</a>","POTUS44",21893,FALSE,FALSE,NA,NA
"44","Just like Michelle says, when they go low, we go high. @HillaryClinton went high and showed why she'll be a POTUS for all Americans.",FALSE,90712,NA,2016-10-10 16:06:27,FALSE,NA,"785511825395765248",NA,"<a href=""http://twitter.com/#!/download/ipad"" rel=""nofollow"">Twitter for iPad</a>","POTUS44",23267,FALSE,FALSE,NA,NA
"45","Voted early today. Make sure you vote too: https://t.co/SUUmUADsHj https://t.co/NMesNhwsaG",FALSE,50734,NA,2016-10-07 21:40:44,FALSE,NA,"784508784316063744",NA,"<a href=""http://twitter.com/#!/download/ipad"" rel=""nofollow"">Twitter for iPad</a>","POTUS44",14393,FALSE,FALSE,NA,NA
"46","Hurricane Matthew is as serious as it gets. Listen to local officials, prepare, take care of each other. https://t.co/Vaf8Xubs0s",FALSE,25329,NA,2016-10-06 23:17:43,FALSE,NA,"784170804279992320",NA,"<a href=""http://twitter.com/download/iphone"" rel=""nofollow"">Twitter for iPhone</a>","POTUS44",9491,FALSE,FALSE,NA,NA
"47","Thank you to every nation that moved to bring the Paris Agreement into force. History will judge today as a turning point for our planet.",FALSE,37986,NA,2016-10-05 20:52:38,FALSE,NA,"783771904297447424",NA,"<a href=""http://twitter.com/download/iphone"" rel=""nofollow"">Twitter for iPhone</a>","POTUS44",9890,FALSE,FALSE,NA,NA
"48","Bringing a little Austin to the South Lawn today. https://t.co/qCXwVI0uLH https://t.co/nTb10I3GHP",FALSE,15022,NA,2016-10-03 15:49:46,FALSE,NA,"782970909229326336",NA,"<a href=""http://twitter.com"" rel=""nofollow"">Twitter Web Client</a>","POTUS44",4796,FALSE,FALSE,NA,NA
"49","What a win by the USA in #RyderCup. Proud to see our guys bring the trophy back home. Arnie is smiling down.",FALSE,18995,NA,2016-10-03 02:00:35,FALSE,NA,"782762238616727552",NA,"<a href=""http://twitter.com"" rel=""nofollow"">Twitter Web Client</a>","POTUS44",3491,FALSE,FALSE,NA,NA
"50","Gandhiji believed in a world worthy of our children. In joining the Paris Agreement, @narendramodi &amp; the Indian people carry on that legacy.",FALSE,35034,NA,2016-10-02 14:54:48,FALSE,NA,"782594690738597888",NA,"<a href=""http://twitter.com"" rel=""nofollow"">Twitter Web Client</a>","POTUS44",13861,FALSE,FALSE,NA,NA
"51","Paid leave shouldn't be a luxury. It's a basic necessity that we should secure for every working American. https://t.co/OPeQiVPJlK",FALSE,16414,NA,2016-10-01 14:00:36,FALSE,NA,"782218662228942848",NA,"<a href=""http://twitter.com/download/iphone"" rel=""nofollow"">Twitter for iPhone</a>","POTUS44",4692,FALSE,FALSE,NA,NA
"52","Our Olympians and Paralympians show the world that no matter what, with perseverance, we can do incredible things. Proud of you, #TeamUSA.",FALSE,21110,NA,2016-09-29 23:38:14,FALSE,NA,"781639251528081409",NA,"<a href=""http://twitter.com"" rel=""nofollow"">Twitter Web Client</a>","POTUS44",3608,FALSE,FALSE,NA,NA
"53","Couldn't be more proud of @HillaryClinton. Her vision and command during last night's debate showed that she's ready to be our next @POTUS.",FALSE,88095,NA,2016-09-27 23:04:33,FALSE,NA,"780906000391864320",NA,"<a href=""http://twitter.com"" rel=""nofollow"">Twitter Web Client</a>","POTUS44",21631,FALSE,FALSE,NA,NA
"54","Democracy is not a spectator sport. Don't give up your power to shape the future of the country we love. Vote: https://t.co/sUxB8TLc5r",FALSE,32319,NA,2016-09-27 16:39:35,FALSE,NA,"780809121314504704",NA,"<a href=""http://twitter.com"" rel=""nofollow"">Twitter Web Client</a>","POTUS44",14728,FALSE,FALSE,NA,NA
"55","Here's to The King who was as extraordinary on the links as he was generous to others. Thanks for the memories, Arn… https://t.co/r4dLQqt45A",FALSE,47296,NA,2016-09-26 03:14:38,TRUE,NA,"780244157625278464",NA,"<a href=""http://twitter.com"" rel=""nofollow"">Twitter Web Client</a>","POTUS44",10741,FALSE,FALSE,NA,NA
"56","Proud to help open @NMAAHC with so many heroes. African American history is a central part of our glorious American history.",FALSE,22484,NA,2016-09-24 14:04:52,FALSE,NA,"779683020043419649",NA,"<a href=""http://twitter.com/download/iphone"" rel=""nofollow"">Twitter for iPhone</a>","POTUS44",7444,FALSE,FALSE,NA,NA
"57","Sabaidii, Laos! Honored to be the first U.S. president to visit Laos and to begin a new partnership between our countries.",FALSE,25356,NA,2016-09-06 01:30:41,FALSE,NA,"772970240602836992",NA,"<a href=""http://twitter.com/#!/download/ipad"" rel=""nofollow"">Twitter for iPad</a>","POTUS44",5087,FALSE,FALSE,NA,NA
"58","Happy Labor Day - longest streak of job growth ever, unemployment cut in half. That's what hardworking Americans can do. Let's keep going!",FALSE,52684,NA,2016-09-05 16:57:23,FALSE,NA,"772841067276333056",NA,"<a href=""http://twitter.com/#!/download/ipad"" rel=""nofollow"">Twitter for iPad</a>","POTUS44",14020,FALSE,FALSE,NA,NA
"59","Congrats to NASA and the scientists taking us a step closer to Mars. Now enjoy Hawaii and get a shave ice! https://t.co/lFZjSnn38x",FALSE,19239,NA,2016-08-29 16:28:19,FALSE,NA,"770297035274584068",NA,"<a href=""http://twitter.com"" rel=""nofollow"">Twitter Web Client</a>","POTUS44",5047,FALSE,FALSE,NA,NA
"60","Congratulations to Maine-Endwell, Little League World Series Champs and still undefeated! Proud of you and the sportsmanship you showed.",FALSE,22307,NA,2016-08-29 00:08:26,FALSE,NA,"770050438578184192",NA,"<a href=""http://twitter.com/download/iphone"" rel=""nofollow"">Twitter for iPhone</a>","POTUS44",4392,FALSE,FALSE,NA,NA
"61","Nearly 100 years ago, women broke down barriers to the ballot box, moving us closer to a more equal nation. Let's finish what they started.",FALSE,63158,NA,2016-08-26 16:08:26,FALSE,NA,"769204867235667969",NA,"<a href=""http://twitter.com"" rel=""nofollow"">Twitter Web Client</a>","POTUS44",21079,FALSE,FALSE,NA,NA
"62","100 years and going strong. Thanks @NatlParkService for your service, so our kids enjoy our parks as much as we have https://t.co/1v3W2HLD6f",FALSE,30703,NA,2016-08-25 18:05:02,FALSE,NA,"768871824885026817",NA,"<a href=""https://about.twitter.com/products/tweetdeck"" rel=""nofollow"">TweetDeck</a>","POTUS44",7088,FALSE,FALSE,NA,NA
"63","Felicitaciones, @JuanManSantos and Colombia. After decades of war, we stand with you in building a future of peace. https://t.co/haXJaqgS9f",FALSE,15863,NA,2016-08-25 15:32:50,FALSE,NA,"768833523729903618",NA,"<a href=""http://twitter.com"" rel=""nofollow"">Twitter Web Client</a>","POTUS44",8865,FALSE,FALSE,NA,NA
"64","Couldn't be prouder of #TeamUSA. Your determination and passion inspired so many of us. You carried that flag high tonight, @Simone_Biles!",FALSE,70507,NA,2016-08-22 01:07:24,FALSE,NA,"767528566099701760",NA,"<a href=""http://twitter.com/download/iphone"" rel=""nofollow"">Twitter for iPhone</a>","POTUS44",15161,FALSE,FALSE,NA,NA
"65","Final win for Phelps. World record for Ledecky. 3 #1 finishes for Biles. That's how #TeamUSA gets America to 1000 golds-way to make history.",FALSE,66491,NA,2016-08-14 23:06:03,FALSE,NA,"764961309767131136",NA,"<a href=""http://twitter.com/download/iphone"" rel=""nofollow"">Twitter for iPhone</a>","POTUS44",14162,FALSE,FALSE,NA,NA
"66","Been waiting to drop this: summer playlist, the encore. What's everybody listening to? https://t.co/mqh1YVrycj",FALSE,219887,NA,2016-08-11 14:31:50,FALSE,NA,"763744742072913920",NA,"<a href=""http://twitter.com"" rel=""nofollow"">Twitter Web Client</a>","POTUS44",100789,FALSE,FALSE,NA,NA
"67","The struggle for the Voting Rights Act taught us that people who love this country can change it. Don't give away your power - go vote.",FALSE,44445,NA,2016-08-06 20:59:47,FALSE,NA,"762030430954684416",NA,"<a href=""http://twitter.com/download/iphone"" rel=""nofollow"">Twitter for iPhone</a>","POTUS44",17253,FALSE,FALSE,NA,NA
"68","Tonight, the first-ever #TeamRefugees will also stand before the world and prove that you can succeed no matter where you're from.",FALSE,38379,"POTUS44",2016-08-05 23:22:08,FALSE,"761703659411345408","761703867402686464","1536791610","<a href=""http://twitter.com/download/iphone"" rel=""nofollow"">Twitter for iPhone</a>","POTUS44",13324,FALSE,FALSE,NA,NA
"69","Ready to root on #TeamUSA! Our team's unity and diversity makes us so proud - and reminds the world why America sets the gold standard.",FALSE,38457,NA,2016-08-05 23:21:18,FALSE,NA,"761703659411345408",NA,"<a href=""http://twitter.com/download/iphone"" rel=""nofollow"">Twitter for iPhone</a>","POTUS44",9422,FALSE,FALSE,NA,NA
"70","Longest streak of total job growth on record, wages rising at fastest pace in 7 years. We've come a long way, America—let's keep it going.",FALSE,40645,NA,2016-08-05 19:11:33,FALSE,NA,"761640808009302016",NA,"<a href=""http://twitter.com"" rel=""nofollow"">Twitter Web Client</a>","POTUS44",11300,FALSE,FALSE,NA,NA
"71","Great speech. She's tested. She's ready. She never quits. That's why Hillary should be our next @POTUS. (She'll get the Twitter handle, too)",FALSE,170206,NA,2016-07-29 03:30:20,FALSE,NA,"758867227328163841",NA,"<a href=""http://twitter.com/download/iphone"" rel=""nofollow"">Twitter for iPhone</a>","POTUS44",55077,FALSE,FALSE,NA,NA
"72","Incredible speech by an incredible woman. Couldn't be more proud &amp; our country has been blessed to have her as FLOTUS. I love you, Michelle.",FALSE,499895,NA,2016-07-26 02:25:19,FALSE,NA,"757763701101490176",NA,"<a href=""http://twitter.com/download/iphone"" rel=""nofollow"">Twitter for iPhone</a>","POTUS44",151676,FALSE,FALSE,NA,NA
"73","¡Bienvenido, amigo! We value our enduring partnership with Mexico &amp; will work to strengthen it in the years to come. https://t.co/mjlABSm7jF",FALSE,15181,NA,2016-07-22 19:17:39,FALSE,NA,"756568912691601410",NA,"<a href=""http://twitter.com"" rel=""nofollow"">Twitter Web Client</a>","POTUS44",3904,FALSE,FALSE,NA,NA
"74","This map says it all. Stay safe as it heats up: Drink water, stay out of the sun, and check on your neighbors. https://t.co/c1qFTmq2IV",FALSE,30602,NA,2016-07-20 16:36:13,FALSE,NA,"755803507760902144",NA,"<a href=""http://twitter.com"" rel=""nofollow"">Twitter Web Client</a>","POTUS44",13825,FALSE,FALSE,NA,NA
"75","44 men came home because Chuck Kettles believed that we leave no man behind. That's America at our best. https://t.co/UymO2AaRHg",FALSE,13137,NA,2016-07-18 14:15:01,FALSE,NA,"755043199731675137",NA,"<a href=""http://twitter.com"" rel=""nofollow"">Twitter Web Client</a>","POTUS44",3279,FALSE,FALSE,NA,NA
"76","Congrats Carla Hayden, our newest Librarian of Congress! Her confirmation is certainly one for the history books.
https://t.co/5T8rvSRp9e",FALSE,19544,NA,2016-07-14 01:38:58,FALSE,NA,"753403382744780800",NA,"<a href=""http://twitter.com"" rel=""nofollow"">Twitter Web Client</a>","POTUS44",6334,FALSE,FALSE,NA,NA
"77","Incredible! After a 5-year journey, we're up close and personal with our solar system's largest planet. Welcome to Jupiter, @NASAJuno!",FALSE,36443,NA,2016-07-05 17:21:09,FALSE,NA,"750379001546416128",NA,"<a href=""http://twitter.com/download/iphone"" rel=""nofollow"">Twitter for iPhone</a>","POTUS44",8927,FALSE,FALSE,NA,NA
